{
  "version": "1.0.0",
  "project_id": "demo",
  "artifact_version": "analysis-v1",
  "created_at": "2026-04-26T00:00:00Z",
  "source_media_manifest_hash": "sha256:aaaaaaaaaaaaaaaaaaaaaaaaaaaaaaaaaaaaaaaaaaaaaaaaaaaaaaaaaaaaaaaa",
  "summary": {
    "status": "partial_override",
    "required_lane_count": 3,
    "ready_lane_count": 2,
    "blocked_lane_count": 0,
    "partial_lane_count": 1
  },
  "lanes": [
    {
      "lane_id": "source_manifest",
      "status": "ready",
      "required": true,
      "reason": null,
      "consumer_impact": "none",
      "asset_ids": ["AST_001"],
      "artifact_hash": "sha256:aaaaaaaaaaaaaaaaaaaaaaaaaaaaaaaaaaaaaaaaaaaaaaaaaaaaaaaaaaaaaaaa"
    },
    {
      "lane_id": "ffprobe",
      "status": "ready",
      "required": true,
      "reason": null,
      "consumer_impact": "none",
      "asset_ids": ["AST_001"],
      "artifact_hash": "sha256:bbbbbbbbbbbbbbbbbbbbbbbbbbbbbbbbbbbbbbbbbbbbbbbbbbbbbbbbbbbbbbbb"
    },
    {
      "lane_id": "stt",
      "status": "waived",
      "required": true,
      "reason": "operator approved no-dialogue override",
      "consumer_impact": "planning_warn",
      "asset_ids": ["AST_001"],
      "artifact_hash": null
    }
  ],
  "assets": [
    {
      "asset_id": "AST_001",
      "status": "partial",
      "lanes": [
        {
          "lane_id": "stt",
          "status": "waived",
          "required": true,
          "reason": "operator approved no-dialogue override",
          "consumer_impact": "planning_warn",
          "asset_ids": ["AST_001"],
          "artifact_hash": null
        }
      ]
    }
  ],
  "blockers": [],
  "overrides": [
    {
      "override_id": "OVR_stt_no_dialogue",
      "status": "active",
      "scope": "stt lane for AST_001, planning only",
      "approved_by": "operator",
      "approved_at": "2026-04-26T00:00:00Z",
      "expires_at": null,
      "applies_to_artifact_hash": "sha256:aaaaaaaaaaaaaaaaaaaaaaaaaaaaaaaaaaaaaaaaaaaaaaaaaaaaaaaaaaaaaaaa"
    }
  ],
  "provenance": {
    "producer": "scripts/analyze.ts",
    "inputs": [
      {
        "path": "projects/demo/02_media/source_media_manifest.json",
        "hash": "sha256:aaaaaaaaaaaaaaaaaaaaaaaaaaaaaaaaaaaaaaaaaaaaaaaaaaaaaaaaaaaaaaaa"
      }
    ],
    "hash_policy": {
      "algorithm": "sha256",
      "canonicalization": "normalized-json-v1",
      "excluded_fields": ["created_at"]
    }
  }
}
